icsa_id,icsa_url,icsa_release,icsa_update,icsa_description,icsa_is_update,icsa_vendor,icsa_oneliner
ICSA-10-070-01A,https://www.us-cert.gov/ics/advisories/ICSA-10-070-01A,2010-05-03,2018-08-23,Rockwell Automation RSLinx Classic EDS Vulnerability (Update A),1,Rockwell Automation," A buffer overflow vulnerability exists in the Rockwell Automation RSLinx Classic EDS Hardware Installation Tool (RSHWare.exe). This vulnerability is likely exploitable; however, significant user interaction would be required."
ICSA-10-070-02,https://www.us-cert.gov/ics/advisories/ICSA-10-070-02,2010-03-10,2014-10-23,Rockwell PLC5/SLC5/0x/RSLogix Security Vulnerability,1,Rockwell Automation," Rockwell Automation has identified a security vulnerability in the programming and configuration client software authentication mechanism employed by certain versions of the PLC-5 and SLC 5/0x family of programmable controllers."
ICSA-10-090-01,https://www.us-cert.gov/ics/advisories/ICSA-10-090-01,2010-03-31,2014-01-20,Mariposa Botnet,0,Other," ICS-CERT has received reports and investigated infections of the Mariposaa botnet, which have affected the business networks of multiple control system owners in recent months. ICS-CERT has no information to indicate that these infections have specifically targeted United States Critical Infrastructure and Key Resources (CIKR), or any specific sector or organization."
ICSA-10-097-01,https://www.us-cert.gov/ics/advisories/ICSA-10-097-01,2010-04-27,2018-09-06,ABB NETCADOPS HELP SYSTEM VULNERABILITY,1,ABB," A cross-site scriptinga vulnerability exists in the system used by the ABB Electrical Distribution Management System (DMS) product netCADOPS to generate online Help."
ICSA-10-147-01,https://www.us-cert.gov/ics/advisories/ICSA-10-147-01,2010-05-27,2014-09-09,Cisco Network Building Mediator,1,Cisco," Cisco has identified multiple security vulnerabilitiesa in the Cisco Network Building Mediator (NBM) products. These vulnerabilities also affect the legacy Richards-Zeta Mediator products. The following vulnerabilities have been identified: default credentials, privilege escalation, unauthorized information interception, and unauthorized information access. Successful exploitation of any of these vulnerabilities could result in a malicious user taking complete control over an affected device."
ICSA-10-201-01C,https://www.us-cert.gov/ics/advisories/ICSA-10-201-01C,2010-08-02,2014-01-08,USB Malware Targeting Siemens Control Software (Update C),1,Siemens," VirusBlokAda, an antivirus vendor based in Belarus, announceda the discovery of malware that uses a zero-day vulnerability in Microsoft Windows processing of shortcut files. The malware utilizes this zero-day vulnerability and exploits systems after users open a USB drive with a file manager capable of displaying icons (like Windows Explorer). US-CERT has released a Vulnerability Noteb detailing the vulnerability and suggested workarounds. Microsoft has also released a Security Advisory (2286198)c detailing the previously unknown vulnerability. ICS-CERT has confirmed the malware installs a trojan that interacts with installed SIMATIC® WinCC or SIMATIC® Siemens STEP 7 software and then makes queries to any discovered SIMATIC® databases. The full capabilities of the malware and intent or results of the queries are not yet known. ICS-CERT is coordinating with Siemens CERT, CERT/CC, Microsoft, and other groups both domestically"
ICSA-10-214-01,https://www.us-cert.gov/ics/advisories/ICSA-10-214-01,2010-08-02,2018-09-06,Wind River VxWorks Vulnerabilities,1,Wind River," A security researcher has identified two vulnerabilities affecting the Wind River Systems’ VxWorks platform. The vulnerabilities are a debug service enabled by default (VU#362332) and a weak hashing algorithm used in authentication (VU#840249). ICS-CERT has been coordinating with CERT/CC in alerting control systems vendors of these vulnerabilities. ICS-CERT will continue to coordinate and publish updates as needed."
ICSA-10-228-01,https://www.us-cert.gov/ics/advisories/ICSA-10-228-01,2010-08-16,2013-05-08,Vendor Admin Accounts Warning,0,Other," An asset owner recently notified the ICS-CERT that a vendor support contractor had added an administrative-level account during installation of new control systems software. The support contractor intended the account to be the default used to train their people for all future work on those systems. The addition of an administrative account to an ICS network with the password known by a contract company increases the cybersecurity risk to the asset owner. This advisory highlights existing practices that may adversely impact the cybersecurity of industrial control systems (ICS) environments relative to malicious actors."
ICSA-10-238-01B,https://www.us-cert.gov/ics/advisories/ICSA-10-238-01B,2010-09-15,2014-01-08,Stuxnet Malware Mitigation (Update B),1,Siemens," In July, ICS-CERT published an advisory and a series of updates regarding the Stuxnet malware entitled “ICSA-10-201 USB Malware Targeting Siemens Control Software.” Since then, ICS-CERT has continued analysis of the Stuxnet malware in an effort to determine more about its capabilities and intent. As the analysis has progressed, understanding of the malware sophistication has continued to increase. Stuxnet makes use of a previously unpatched Windows vulnerability and a digitally signed kernel-mode rootkit. There have been two digital certificates used to sign this rootkit. The original certificate was revoked. Subsequently, a second variant was discovered in which the same rootkit was signed with a different key, which has also been revoked. With approximately 4,000 functions, Stuxnet contains as much code as some commercial software products. The complex code is object oriented and employs many programming techniques that demonstrate advanced knowledge in many areas, including the Windows operating system, Microsoft SQL Server, Siemens software, and Siemens PLCs. The malware also employs many advanced anti-analysis techniques that make reverse engineering difficult and time consuming. ICS-CERT has identified that while USB drives appear to be a primary infection mechanism, Stuxnet can also infect systems through network shares and SQL databases. The Stuxnet malware stores dropped files in many locations on a target system. The infection mechanism is complex, and the exact files that may be dropped will vary depending on the system it is infecting. After infecting a system, the malware gathers extensive data from MS SQL server, Windows registry, and application software. Once the malware has installed itself on a system, it employs many evasive techniques, including bypassing antivirus software, advanced process injection, hooking useful functions by kernel-mode rootkits, and the quick removal of temporary files. ICS-CERT is continuing to reverse engineer and analyze this malware. Because of the malware’s complexity, this work is expected to take some time."
ICSA-10-264-01,https://www.us-cert.gov/ics/advisories/ICSA-10-264-01,2010-09-21,2018-09-06,SCADA Engine BACnet OPC Client Buffer Overflow Vulnerability,1,SCADA Engine," This advisory is a follow-up to ICS-ALERT-10-260-01 SCADA Engine BACnet OPC Client Buffer Overflow, which was published on the ICS-CERT Web site on September 17, 2010. A buffer overflow vulnerability has been reporteda in SCADA Engine’s BACnet OPC Client. Using a specially crafted malicious file, this vulnerability could allow an attacker to crash the application and execute arbitrary code. A software update is available that resolves this vulnerability. ICS-CERT is aware that exploit code for this vulnerability is publicly available.b  However, ICS-CERT has not received any reports of the vulnerability being exploited in the wild."
ICSA-10-272-01,https://www.us-cert.gov/ics/advisories/ICSA-10-272-01,2010-09-29,2018-09-06,Primary Stuxnet Advisory,1,Other," ICS-CERT has been actively investigating and reporting on the Stuxnet vulnerability. To date, ICS-CERT has released ICSA-10-201-01 - Malware Targeting Siemens Control Software (including Updates B &amp; C) and ICSA-10-238-01 - Stuxnet Mitigations (including Update B). Stuxnet uses four zero-day exploits (two of which have been patched) and takes advantage of a vulnerability also exploited by Conficker, which has been documented in Microsoft Security Bulletin MS-08-067.a The known methods of propagation include infected USB devices, network shares, STEP 7 Project files, WinCC database files, and the print spooler vulnerability addressed by MS-10-061.b The malware can be updated through a command and control infrastructure as well as peer-to-peer communication using the Remote Procedure Call (RPC) protocol. The malware also interacts with Siemens SIMATIC WinCC or SIMATIC STEP 7 software. Exact software versions and configurations that may be affected are still being analyzed jointly by ICS-CERT and Siemens. We have listed the following indicators for use in detecting this malware."
ICSA-10-301-01A,https://www.us-cert.gov/ics/advisories/ICSA-10-301-01A,2010-11-10,2018-08-23,MOXA Device Manager Buffer Overflow (Update A),1,Moxa,
ICSA-10-313-01,https://www.us-cert.gov/ics/advisories/ICSA-10-313-01,2010-11-08,2018-09-06,RealFlex RealWin Buffer Overflow,1,RealFlex Technologies," This advisory is a follow-up to ICS-ALERT-10-305-01 RealFlex RealWin Buffer Overflows, which was published on the ICS-CERT Web site on November 01, 2010. On October 15, 2010 an independent security researcher posted informationa  regarding vulnerabilities in RealFlex Technologies Ltd. RealWin SCADA software products. The security researcher’s analysis indicated that successful exploitation of these vulnerabilities can lead to arbitrary code execution and control of the system. RealFlex Technologies has validated the researcher’s findings and released an updateb to resolve these issues. ICS-CERT has verified that the software update resolves the vulnerabilities highlighted by the researcher."
ICSA-10-314-01A,https://www.us-cert.gov/ics/advisories/ICSA-10-314-01A,2011-02-15,2018-08-23,ClearScada Vulnerabilities (Update A),1,Schneider Electric," Researchers at Digital Bond have identified multiple vulnerabilities in the Control Microsystems ClearSCADA application. The following vulnerabilities have been identified: Heap Overflow VulnerabilityCross-site Scripting VulnerabilitiesInsecure Web Authentication."
ICSA-10-316-01A,https://www.us-cert.gov/ics/advisories/ICSA-10-316-01A,2010-12-15,2018-09-06,Intellicom NetBiter WebSCADA Vulnerabilities (Update A),1,Intellicom," This advisory is a follow-up to ICS-ALERT-10-293-01 - Intellicom NetBiter WebSCADA Vulnerabilities, published on the ICS-CERT Web page on October 20, 2010. On October 1, 2010 independent researchers identified vulnerabilities in the Intellicom NetBiter Supervisory Control and Data Acquisition (SCADA) applications. A directory traversal vulnerability is present in all affected devices that lead to local file disclosure. The ability to upload malicious web content using a custom logo page is also possible. All of the reported vulnerabilities require superadmin privileges. If the default password is not changed, the vulnerability can be leveraged to gain additional access to an affected device’s file system."
ICSA-10-322-01,https://www.us-cert.gov/ics/advisories/ICSA-10-322-01,2010-12-14,2013-04-29,Ecava IntegraXor Buffer Overflow,1,Ecava," The ICS-CERT has received a report from independent security researcher Jeremy Brown that reveals a stack-based buffer overflow vulnerability in the Ecava IntegraXor Human-Machine Interface (HMI) product that could allow the execution of arbitrary code. Ecava has verified the claim and has released a patch to mitigate the vulnerability (igsetup-3.5.3900.10.msi or later)."
ICSA-10-322-02A,https://www.us-cert.gov/ics/advisories/ICSA-10-322-02A,2010-11-17,2013-08-28,Automated Solutions OPC Vulnerability (Update),1,Automated Solutions," The ICS-CERT has received a report from independent security researcher Jeremy Brown that reveals a heap corruption vulnerability in the Automated Solutions Modbus/TCP Master OPC server. Automated Solutions has confirmed that their most recent patch mitigates the vulnerability for Version 3.0.0. ICS-CERT has verified that the software update resolves the vulnerability identified by the researcher. --------- Begin Update A-------- The vulnerability could be exploited by creating a Modbus/TCP Slave application that generates non-compliant Modbus/TCP reply packets. Successful exploitation would likely not allow arbitrary code execution; however, an exploit could possibly corrupt the OPC server memory. --------- End Update A--------"
ICSA-10-337-01,https://www.us-cert.gov/ics/advisories/ICSA-10-337-01,2011-01-02,2013-10-28,Advantech Studio Test Web Server Buffer Overflow,1,Advantech," The ICS-CERT has received a report from independent security researcher Jeremy Brown that reveals a stack-based buffer overflow vulnerability in the test web server bundled with Advantech Studio Version 6.1. This web server is intended to be used for testing purposes and should not be used in a production environment. Advantech has verified the problem and has developed a patch to mitigate the vulnerability."
ICSA-10-348-01A,https://www.us-cert.gov/ics/advisories/ICSA-10-348-01A,2011-03-02,2013-04-22,Wonderware InBatch Vulnerability (Update A),1,Invensys," An independent security researcher has published information to a vulnerability disclosure website regarding a buffer overflow vulnerability in the Wonderware InBatch and I/A Series Batch software products (all supported versions). According to the researcher’s report, the service listening on TCP Port 9001 is vulnerable to a buffer overflow that could cause denial of service (DOS) or the possible execution of arbitrary code. This vulnerability is remotely exploitable and exploit code is publicly available. --------- Begin Update A Part 1 of 2 ---------- Invensys has validated the researcher’s claim and has released a patch for this vulnerability. The patchcan be downloaded at Invensys Cyber Security Updates page.a ICS-CERT has validated the patch. ---------- End Update A Part 1 of 2 ---------- ICS-CERT is coordinating this vulnerability disclosure with Invensys and the CERT Coordination Center (CERT/CC)."
ICSA-10-362-01,https://www.us-cert.gov/ics/advisories/ICSA-10-362-01,2010-12-28,2018-09-06,Ecava IntegraXor Directory Traversal,1,Ecava," This advisory is a follow-up to ICS-ALERT-10-355-01 - Ecava IntegraXor Directory Traversal, published on the ICS-CERT Web page on December 21, 2010. ICS-CERT has become aware of a directory traversal vulnerability in the Ecava IntegraXor Human-Machine Interface (HMI) product that could allow data leakage. ICS-CERT is currently in contact with representatives of Ecava who have verified the vulnerability. Ecava has developed and released a patch to mitigate the vulnerability (igsetup-3.6.4000.1.msi or later) and has notified its customer base of the availability of the patch (http://www.integraxor.com/download/igsetup.msi). This patch has been verified by both the ICS-CERT and the independent security researcher."
ICSA-11-017-01,https://www.us-cert.gov/ics/advisories/ICSA-11-017-01,2011-01-17,2018-09-06,WellinTech Kingview 6.53 Remote Heap Overflow,1,WellinTech," This advisory is a follow-up to ICS-ALERT-11-011-01 WellinTech Kingview Buffer Overflow, published on the ICS-CERT Web site on January 11, 2011. Independent security researcher Dillon Beresford reported a heap overflow vulnerability in WellinTech KingView V6.53, which may allow a remote, unauthenticated attacker to execute arbitrary code. ICS-CERT has verified the vulnerability. WellinTech has developed and released a patch to mitigate this vulnerability, 6.53(2010-12-15). This patch has been validated by both ICS-CERT and the independent security researcher."
ICSA-11-017-02,https://www.us-cert.gov/ics/advisories/ICSA-11-017-02,2011-01-17,2018-09-06,Sielco Sistemi WinLog Stack Overflow,1,Sielco Sistemi," Independent researcher Luigi Auriemma reported a stack overflow vulnerability in Version 2.07.00 of the Sielco Sistemi WinLog Lite and Winlog Pro HMI software. Sielco Sistemi has developed an update (Version 2.07.01) to address this vulnerability. The researcher has verified that the update is effective in correcting this vulnerability."
ICSA-11-018-01,https://www.us-cert.gov/ics/advisories/ICSA-11-018-01,2011-01-18,2018-09-05,AGG SCADA Viewer OPC Buffer Overflow Vulnerability,1,AGG Software," The ICS-CERT has received a report from independent security researcher Steven James that a stack-based buffer overflow exists in the AGG Software OPC SCADA Viewer software. The vulnerability could allow arbitrary code execution. ICS-CERT has coordinated with AGG Software, which has developed a patch to address this vulnerability. The researcher has also verified that the patch resolves the issue."
ICSA-11-018-02,https://www.us-cert.gov/ics/advisories/ICSA-11-018-02,2011-02-08,2018-09-05,7-Technologies IGSS 8 ODBC Server Remote Heap Corruption,1,7-Technologies," ICS-CERT has received a report from independent security researcher Jeremy Brown that a remote heap corruption vulnerability exists in IGSS (Interactive Graphical SCADA System) Version 8 from 7-Technologies (7T). 7T has verified the vulnerability and has developed a patch."
ICSA-11-025-01,https://www.us-cert.gov/ics/advisories/ICSA-11-025-01,2011-01-25,2018-08-23,Federal Aviation Administration GPS Testing,1,Other," The US Federal Aviation Administration (FAA) has issued two flight advisories identifying planned Global Positioning System (GPS) temporary outages and the affected areas, due Department of Defense testing. During testing, the GPS signal may be unreliable or unavailable. ICS-CERT is issuing this advisory as a follow up to yesterday’s alert to notify industrial control systems (ICS) owners and operators whose control systems employ GPS for timing reference or positioning data of possible intermittent GPS service during the testing."
ICSA-11-041-01A,https://www.us-cert.gov/ics/advisories/ICSA-11-041-01A,2011-02-11,2018-09-06,McAfee Night Dragon Report (Update A),1,Other," McAfee has published a white paper titled “Global Energy Cyberattacks: Night Dragon,”a  which describes advanced persistent threat activity designed to obtain sensitive data from targeted organizations in the global oil, energy, and petrochemical industries. According to the report, this activity began in 2009 or potentially as early as 2007."
ICSA-11-056-01A,https://www.us-cert.gov/ics/advisories/ICSA-11-056-01A,2011-06-14,2018-09-05,Progea Movicon TCPUploadServer (Update A),1,Progea," ICS-CERT has received a report from independent security researcher Jeremy Brown of a data leakage and denial-of-service vulnerability in Progea’s Movicon 11 human machine interface (HMI) product. Progea has verified the vulnerability and has developed a patch to address the issue. ICS-CERT has verified that the patch resolves the vulnerability."
ICSA-11-069-01B,https://www.us-cert.gov/ics/advisories/ICSA-11-069-01B,2011-06-07,2018-09-05,Samsung Data Management Server (Update B),1,Samsung," This updated website posting provides new information regarding Samsung’s process for acquiring the updated software to mitigate the reported vulnerability. José A. Guasch,a reported a SQL injection vulnerability in the Samsung Data Management Server (DMS). Samsung has released an update and ICS-CERT has verified that the software update corrects the vulnerability."
ICSA-11-074-01,https://www.us-cert.gov/ics/advisories/ICSA-11-074-01,2011-03-15,2018-09-06,WellinTech KingView 6.53 KVWebSvr ActiveX,1,WellinTech," This advisory is a follow-up to ICS-ALERT-11-066-01 - WellinTech KingView 6.53 ActiveX Vulnerability, published on the ICS-CERT Web page on March 7, 2011. An independent security researcher reported a stack-based buffer overflow vulnerability in an ActiveX control in WellinTech KingView V6.53. The researcher has publicly released exploit code for this vulnerability. Successful exploitation of this vulnerability could allow a remote attacker to execute arbitrary code. WellinTech has released an update for the vulnerable file. ICS-CERT has confirmed the update resolves the vulnerability."
ICSA-11-082-01,https://www.us-cert.gov/ics/advisories/ICSA-11-082-01,2011-03-23,2013-04-30,Ecava IntegraXor SQL,1,Ecava," ICS-CERT has received a report from independent security researcher Dan Rosenberg with Virtual Security Research (VSR) of an unauthenticated Structured Query Language (SQL) vulnerability in the Ecava IntegraXor human machine interface (HMI) product that could allow data leakage, data manipulation, and remote code execution against the backend host running the database service. ICS-CERT has coordinated with Ecava, which has verified the vulnerability and developed a patched release of IntegraXor (Build 4050) to address this vulnerability. Both ICS-CERT and the independent security researcher have validated the patch."
ICSA-11-084-01,https://www.us-cert.gov/ics/advisories/ICSA-11-084-01,2011-03-26,2014-01-02,Solar Magnetic Storm Impact on Control Systems,0,Other," The sun generates solar flare and coronal mass ejection (CME) events in an approximate 11-year cycle. The plasma clouds generated from these events have the potential to cause geomagnetic storms that can interfere with terrestrial communications and other electronic systems, posing a risk to critical infrastructure.In a recent case, Earth-orbiting satellites detected the strongest magnetic storm in more than 4 years resulting from a solar flare and CME event.a Figure 1 illustrates the size of the CME shockwave edge in relation to the size of the sun at the point of the eruption.      Figure 1. X2-solar flare and coronal mass ejection at the time of the eruption.  At 0156 UT on February 15, 2011, Active Region 11158 unleashed an X2-class eruption.b X-flares are the largest type of X-ray flares, and this is the first such eruption of new Solar Cycle 24. The explosion that produced this flare also sent a solar tsunami rippling through the sun’s atmosphere and hurled a CME toward Earth. By the time the CME reached the Earth, the shockwave leading edge had expanded to approximately 40 million miles across. CME activity will continue to occur as this solar cycle progresses. The purpose of this Advisory is to inform the industrial control systems (ICS) community of the possible impacts of solar magnetic storms on critical infrastructure control systems. This Advisory provides a high-level overview of the potential problems and offers some general mitigation strategies for consideration by the ICS community."
ICSA-11-091-01A,https://www.us-cert.gov/ics/advisories/ICSA-11-091-01A,2011-04-05,2018-09-06,Siemens Tecnomatix FactoryLink Vulnerabilities (Update A),1,Siemens," This ICS-CERT Advisory is a follow-up to ICS-ALERT-11-080-01. An independent researcher has identified six vulnerabilities in the Siemens Tecnomatix FactoryLink supervisory control and data acquisition (SCADA) product. The researcher has also publicly released exploit code. The researcher identified the following vulnerabilities types: Buffer overflow (2 vul)Absolute Path Traversal (3 vul)NULL Pointer Dereference (1 vul). Siemens has released a patch addressing the identified vulnerablities. ICS-CERT has not yet validated this patch."
ICSA-11-094-01,https://www.us-cert.gov/ics/advisories/ICSA-11-094-01,2011-04-13,2018-09-06,Wonderware InBatch Client ActiveX Buffer Overflow,1,Invensys," ICS-CERT has received a report from independent security researcher Jeremy Brown regarding a buffer overflow vulnerability in a Wonderware InBatch Client ActiveX control. According to the researcher’s report, the client ActiveX control is vulnerable to a buffer overflow that could cause denial of service (DoS) or the possible execution of arbitrary code in older versions. In order to successfully exploit this vulnerability, the attacker must direct the InBatch client user to a malicious host. This exploit requires the attacker to perform social engineering. Invensys has validated the researcher’s claim and has developed a patch to mitigate this vulnerability. ICS-CERT has verified that the provided security patch resolves the vulnerability."
ICSA-11-094-02B,https://www.us-cert.gov/ics/advisories/ICSA-11-094-02B,2014-01-07,2018-09-06,Advantech/Broadwin WebAccess RPC Vulnerability (Update B),1,Advantech," This updated advisory is a follow-up to the updated advisory titled ICSA-11-094-02A Advantech/Broadwin WebAccess RPC Vulnerability that was published November 4, 2011, on the NCCIC/ICS-CERT Web site."
ICSA-11-096-01,https://www.us-cert.gov/ics/advisories/ICSA-11-096-01,2011-04-06,2018-09-06,GLEG Agora SCADA+ Exploit Pack,1,Other," On March 15, 2011, GLEG Ltd. announced the Agora SCADA+ Exploit Pack for Immunity’s CANVAS system. CANVAS is a penetration testing framework that is extensible using CANVAS Exploit Packs. On March 25, 2011, GLEG announced it would be adding exploits for the 35 vulnerabilities released by Luigi Auriemma on March 21, 2011. The ICS-CERT has not received any reports of this tool being used for an unauthorized compromise of an actual control system installation. ICS-CERT has prepared this advisory to provide an initial summary of the possible vulnerabilities contained in this exploit pack. Please note that at this time, the information contained in this report is not conclusive, nor is it comprehensive. This report represents a cursory and credible snapshot of the vulnerabilities that are likely contained in the pack, based on the analysis conducted by ICS-CERT."
ICSA-11-103-01A,https://www.us-cert.gov/ics/advisories/ICSA-11-103-01A,2011-08-15,2014-03-13,Honeywell ScanServer ActiveX Control (Update A),1,Honeywell,
