icsa_id,icsa_url,icsa_release,icsa_update,icsa_description,icsa_is_update,icsa_vendor,icsa_oneliner
ICSA-14-343-02,https://www.us-cert.gov/ics/advisories/ICSA-14-343-02,2014-12-09,2018-08-23,Trihedral Engineering Limited VTScada Integer Overflow Vulnerability,1,Trihedral Engineering Limited," An anonymous researcher working with HP’s Zero Day Initiative has identified an integer overflow vulnerability in Trihedral Engineering Ltd’s VTScada application. Trihedral Engineering Limited has produced a patch that mitigates this vulnerability. This vulnerability could be exploited remotely."
ICSA-14-345-01,https://www.us-cert.gov/ics/advisories/ICSA-14-345-01,2015-01-15,2018-08-29,Arbiter Systems 1094B GPS Clock Spoofing Vulnerability,1,Arbiter Systems," This advisory was originally posted to the US-CERT secure Portal library on December 11, 2014, and is being released to the NCCIC/ICS-CERT web site. Arbiter Systems has identified a GPS clock spoofing vulnerability in its 1094B clock. Arbiter Systems has produced a new product that is not vulnerable to this type of attack. This vulnerability could be exploited remotely."
ICSA-14-350-01,https://www.us-cert.gov/ics/advisories/ICSA-14-350-01,2014-12-16,2018-09-05,Schneider Electric ProClima Command Injection Vulnerabilities,1,Schneider Electric," NCCIC/ICS-CERT received a report from HP’s Zero Day Initiative (ZDI) concerning command injection vulnerabilities in Schneider Electric’s ProClima software package. These vulnerabilities were reported to ZDI by security researchers Ariele Caltabiano, Andrea Micalizzi, and Brian Gorenc. Schneider Electric has produced an update version that mitigates these vulnerabilities. These vulnerabilities could be exploited remotely."
ICSA-14-350-02,https://www.us-cert.gov/ics/advisories/ICSA-14-350-02,2015-03-17,2018-08-27,Johnson Controls Metasys Vulnerabilities,1,Johnson Controls," This advisory was originally posted to the US-CERT secure Portal library on December 16, 2014, and is being released to the NCCIC/ICS-CERT web site. Independent security researcher Billy Rios has identified two vulnerabilities in Johnson Controls Metasys building management system. Johnson Controls has produced patches for each affected release that mitigates these vulnerabilities. These vulnerabilities could be exploited remotely."
ICSA-14-352-01,https://www.us-cert.gov/ics/advisories/ICSA-14-352-01,2014-12-18,2019-04-10,Honeywell Experion PKS Vulnerabilities,1,Honeywell," Alexander Tlyapov, Gleb Gritsai, Kirill Nesterov, Artem Chaykin and Ilya Karpov of the Positive Technologies Research Team and Security Lab have identified vulnerabilities in Honeywell’s Experion Process Knowledge System (EPKS) application. Honeywell has produced several patch updates (R400.6, R410.6 and 430.6) that resolve these vulnerabilities. These vulnerabilities could be exploited remotely."
ICSA-14-352-02,https://www.us-cert.gov/ics/advisories/ICSA-14-352-02,2014-12-18,2018-09-05,Innominate mGuard Privilege Escalation Vulnerability,0,Innominate," Innominate Security Technologies has identified a privilege escalation vulnerability affecting all mGuard devices. Innominate has produced a firmware patch that mitigates this vulnerability. This vulnerability could be exploited remotely."
ICSA-14-353-01-SupplementA,https://www.us-cert.gov/ics/advisories/ICSA-14-353-01-SupplementA,2015-03-05,1900-01-01,Network Time Protocol Vulnerabilities (Supplement Update A),1,Other,
ICSA-14-353-01C,https://www.us-cert.gov/ics/advisories/ICSA-14-353-01C,2015-02-05,2018-08-29,Network Time Protocol Vulnerabilities (Update C),1,Other," This updated advisory is a follow-up to the updated advisory titled ICSA-14-353-01B Network Time Protocol Vulnerabilities that was published February 4, 2015, on the NCCIC/ICS-CERT web site. Google Security Team researchers Neel Mehta and Stephen Roettger have coordinated multiple vulnerabilities with CERT/CC concerning the Network Time Protocol (NTP). As NTP is widely used within operational industrial control systems deployments, ICS-CERT is providing this information for US critical infrastructure asset owners and operators for awareness and to identify mitigations for affected devices. ICS-CERT may release updates as additional information becomes available. These vulnerabilities could be exploited remotely. Products using NTP service prior to ntp-4.2.8p1 are affected. This is an open source protocol."
ICSA-15-006-01,https://www.us-cert.gov/ics/advisories/ICSA-15-006-01,2015-07-16,2018-08-27,Eaton’s Cooper Power Series Form 6 Control and Idea/IdeaPlus Relays with Ethernet Vulnerability,1,Eaton&amp;#039;s Cooper Power Systems," This advisory was originally posted to the US-CERT secure Portal library on January 6, 2015, and is now being released to the NCCIC/ICS-CERT web site. Dr. Raheem Beyah, David Formby, and San Shin Jung of Georgia Tech, via a research project partially sponsored by the Georgia Tech National Electric Energy Testing Research and Applications Center (NEETRAC), have identified a predictable TCP sequence vulnerability in Eaton’s Cooper Power Systems Form 6 controls and Idea/IdeaPLUS relays with Ethernet application. Eaton’s Cooper Power Systems has produced a patch to mitigate this vulnerability. These researchers have tested the patch to validate that it resolves the vulnerability.This vulnerability could be exploited remotely."
ICSA-15-008-01A,https://www.us-cert.gov/ics/advisories/ICSA-15-008-01A,2015-01-09,2018-08-29,Emerson HART DTM Vulnerability (Update A),1,Emerson," This updated advisory is a follow-up to the original advisory titled ICSA-15-008-01 Emerson HART DTM Vulnerability that was published January 8, 2015, on the NCCIC/ICS-CERT web site. Alexander Bolshev of Digital Security has identified an improper input vulnerability in the CodeWrights HART Device Type Manager (DTM) library utilized in Emerson’s HART DTM. CodeWrights has addressed the vulnerability with a new library, which Emerson has begun to integrate. Emerson has tested the new library to validate that it resolves the vulnerability."
ICSA-15-008-02,https://www.us-cert.gov/ics/advisories/ICSA-15-008-02,2015-01-08,2018-08-27,Schneider Electric Wonderware InTouch Access Anywhere Server Buffer Overflow Vulnerability,1,Schneider Electric," Schneider Electric Wonderware has identified a stack-based buffer overflow vulnerability in the Wonderware InTouch Access Anywhere Server product. Schneider Electric has produced a security update that mitigates this vulnerability. This vulnerability could be exploited remotely."
ICSA-15-012-01C,https://www.us-cert.gov/ics/advisories/ICSA-15-012-01C,2015-02-05,2018-08-29,CodeWrights GmbH HART Device DTM Vulnerability (Update C),1,CodeWrights GmbH," This updated advisory is a follow-up to the updated advisory titled ICSA-15-012-01B CodeWrights GmbH HART DTM Vulnerability that was published January 27, 2015, on the NCCIC/ICS-CERT web site. Alexander Bolshev of Digital Security has identified an improper input validation vulnerability in CodeWrights GmbH HART Device Type Manager (DTM) libraries. CodeWrights GmbH produces DTM libraries for vendors of HART Device DTM products. CodeWrights GmbH has updated the libraries that mitigate this vulnerability. Using CodeWrights GmbH’s updated library for HART Device DTM, Emerson has tested the new library to validate that it resolves the vulnerability."
ICSA-15-013-01,https://www.us-cert.gov/ics/advisories/ICSA-15-013-01,2015-01-13,2018-08-29,Siemens SIMATIC WinCC Sm@rtClient iOS Application Authentication Vulnerabilities,1,Siemens," Siemens has identified authentication vulnerabilities in the SIMATIC WinCC Sm@rt Client application. These vulnerabilities were reported directly to Siemens by Kim Schlyter, Seyton Bradford, and Richard Warren from FortConsult (NCC Group). Siemens has produced an update that mitigates these vulnerabilities."
ICSA-15-013-02,https://www.us-cert.gov/ics/advisories/ICSA-15-013-02,2015-01-13,2018-08-29,Clorius Controls A/S ISC SCADA Insecure Java Client Web Authentication,1,Clorius Controls A/S," Independent researcher Aditya Sood has identified an insecure Java client web authentication vulnerability in the Clorius Controls A/S ISC SCADA server. Clorius Controls A/S has produced an update that mitigates this vulnerability. Aditya Sood has tested the update to validate that it resolves the vulnerability. This vulnerability could be exploited remotely."
ICSA-15-013-03,https://www.us-cert.gov/ics/advisories/ICSA-15-013-03,2015-01-13,2019-01-24,Phoenix Contact Software ProConOs and MultiProg Authentication Vulnerability,1,PHOENIX CONTACT," Reid Wightman of Digital Bond has identified an authentication vulnerability in Phoenix Contact Software’s ProConOs and MultiProg applications. KW-Software originally wrote these applications without authentication intentionally. This vulnerability could be exploited remotely."
ICSA-15-013-04A,https://www.us-cert.gov/ics/advisories/ICSA-15-013-04A,2015-01-13,2015-08-04,GE Multilink Switch Vulnerabilities (Update A),1,GE," This updated advisory is a follow-up to the original advisory titled ICSA-15-013-04 GE MultiLink Switch Vulnerabilities that was published January 13, 2015, on the NCCIC/ICS-CERT web site."
ICSA-15-020-01,https://www.us-cert.gov/ics/advisories/ICSA-15-020-01,2015-01-20,2018-08-29,Siemens SCALANCE X-300/X408 Switch Family DOS Vulnerabilities,1,Siemens," Siemens has identified denial-of-service (DoS) vulnerabilities in the SCALANCE X-300/X408 switch family. These vulnerabilities were reported directly to Siemens by Déjà vu Security. Siemens has produced a firmware update that mitigates these vulnerabilities. These vulnerabilities could be exploited remotely."
ICSA-15-020-02,https://www.us-cert.gov/ics/advisories/ICSA-15-020-02,2015-01-20,2018-08-29,Schneider Electric ETG3000 FactoryCast HMI Gateway Vulnerabilities,1,Schneider Electric," Narendra Shinde of Qualys Security has identified multiple vulnerabilities in Schneider Electric’s ETG3000 FactoryCast HMI Gateway. Schneider Electric has produced a firmware update that mitigates part of these vulnerabilities. These vulnerabilities could be exploited remotely."
ICSA-15-022-01,https://www.us-cert.gov/ics/advisories/ICSA-15-022-01,2015-01-22,2018-08-29,Siemens SIMATIC S7-1200 CPU Web Vulnerability,1,Siemens," Siemens has identified an open redirect vulnerability in the SIMATIC S7-1200 CPU family. This vulnerability was reported directly to Siemens by Ralf Spenneberg, Hendrik Schwartke, and Maik Brüggemann from OpenSource Training. Siemens has produced an update that mitigates this vulnerability. This vulnerability could be exploited remotely."
ICSA-15-027-01,https://www.us-cert.gov/ics/advisories/ICSA-15-027-01,2015-01-27,2018-08-29,Magnetrol HART DTM Vulnerability,1,Magnetrol," Alexander Bolshev of Digital Security has identified an improper input validation vulnerability in the CodeWrights GmbH HART Device Type Manager (DTM) library extension utilized by some Magnetrol products. CodeWrights GmbH has updated its software library to mitigate this vulnerability. Magnetrol has integrated this update and released its revised library extensions."
ICSA-15-027-02,https://www.us-cert.gov/ics/advisories/ICSA-15-027-02,2015-01-27,2018-08-29,Schneider Electric Multiple Products Buffer Overflow Vulnerability,1,Schneider Electric," NCCIC/ICS-CERT received a report from Ariele Caltabiano (kimiya) with HP’s Zero Day Initiative (ZDI) concerning a buffer overflow vulnerability in Schneider Electric’s SoMove Lite software package. While addressing this vulnerability, Schneider Electric identified multiple vulnerable Schneider Electric products. Schneider Electric has produced a patch that mitigates this vulnerability. This vulnerability could be exploited remotely."
ICSA-15-029-01,https://www.us-cert.gov/ics/advisories/ICSA-15-029-01,2015-01-29,2018-08-29,Honeywell HART DTM Vulnerability,1,Honeywell," Alexander Bolshev of Digital Security has identified an improper input vulnerability in the CodeWrights GmbH HART Device Type Manager (DTM) library used in Honeywell’s HART DTM. CodeWrights GmbH has addressed the vulnerability with a new library, which Honeywell validated and released for the impacted products."
ICSA-15-034-01,https://www.us-cert.gov/ics/advisories/ICSA-15-034-01,2015-02-03,2018-08-29,Siemens SCALANCE X-200IRT Switch Family User Impersonation Vulnerability,1,Siemens," Siemens has identified a user impersonation vulnerability in its SCALANCE X-200IRT Switch Family. Siemens has produced a firmware update that mitigates this vulnerability. This vulnerability could be exploited remotely."
ICSA-15-034-02,https://www.us-cert.gov/ics/advisories/ICSA-15-034-02,2015-02-03,2018-08-29,Siemens Ruggedcom WIN Vulnerability,1,Siemens," IOActive has coordinated with Siemens regarding multiple vulnerabilities in the Ruggedcom WIN firmware. Siemens has produced firmware updates that mitigates these vulnerabilities. These vulnerabilities could be exploited remotely if there is network access to the affected service."
ICSA-15-036-01A,https://www.us-cert.gov/ics/advisories/ICSA-15-036-01A,2015-03-24,2018-08-27,GE and MACTek HART Device DTM Vulnerability (Update A),1,"GE, MACTek"," This updated advisory is a follow-up to the original advisory titled ICSA-15-036-01 GE and MACTek HART Device DTM Vulnerability that was published February 5, 2015, on the NCCIC/ICS-CERT web site. Alexander Bolshev and Svetlana Cherkasova of Digital Security have identified an improper input vulnerability in the HART Device Type Manager (DTM) library utilized in GE and MACTek’s HART Device DTM. GE has addressed the vulnerability with a new library, which both companies have begun to integrate. GE has tested the new library to validate that it resolves the vulnerability."
ICSA-15-036-02,https://www.us-cert.gov/ics/advisories/ICSA-15-036-02,2015-02-05,2018-10-30,Pepperl+Fuchs Hart Device DTM Vulnerability,0,PEPPERL+FUCHS," Alexander Bolshev of Digital Security has identified an improper input vulnerability in the CodeWrights GmbH HART Device Type Manager (DTM) library utilized in PEPPERL+FUCHS HART Device DTM. CodeWrights GmbH has addressed the vulnerability with a new library, which Pepperl+Fuchs has begun to integrate."
ICSA-15-041-01,https://www.us-cert.gov/ics/advisories/ICSA-15-041-01,2015-02-10,2018-08-29,Advantech EKI-1200 Buffer Overflow,1,Advantech," Enrique Nissim and Pablo Lorenzzato from Core Security Engineering Team have identified a buffer overflow vulnerability in Advantech EKI-1200 product line. Advantech has produced a patch that mitigates this vulnerability. CORE Security has tested the patch to validate that it resolves the vulnerability. This vulnerability could be exploited remotely."
ICSA-15-041-02,https://www.us-cert.gov/ics/advisories/ICSA-15-041-02,2015-03-10,2018-08-27,GE Hydran M2 Predictable TCP Initial Sequence Vulnerability,0,GE," This advisory was originally posted to the US-CERT secure Portal library on February 10, 2015, and is being released to the NCCIC/ICS-CERT web site. Raheem Beyah, David Formby, and San Shin Jung of Georgia Tech, via a research project partially sponsored by the Georgia Tech National Electric Energy Testing Research and Applications Center, identified a predictable TCP sequence vulnerability in GE Digital Energy’s Hydran M2 device, containing the 17046 Ethernet option. The vulnerability has been eliminated from products released after October 2014. This vulnerability could be exploited remotely."
ICSA-15-048-01,https://www.us-cert.gov/ics/advisories/ICSA-15-048-01,2015-02-17,2018-08-29,Siemens SIMATIC STEP 7 TIA Portal Vulnerabilities,1,Siemens," Aleksandr Timorin from Positive Technologies has identified authentication vulnerabilities in the Siemens SIMATIC STEP 7 TIA Portal application. Siemens has produced a service pack that mitigates these vulnerabilities."
ICSA-15-048-02,https://www.us-cert.gov/ics/advisories/ICSA-15-048-02,2015-02-17,2018-08-29,Siemens SIMATIC WinCC TIA Portal Vulnerabilities,1,Siemens," Gleb Gritsai, Roman Ilin, Aleksandr Tlyapov, and Sergey Gordeychik from Positive Technologies have identified authentication vulnerabilities in the Siemens SIMATIC WinCC TIA Portal application. Siemens has produced a service pack that mitigates these vulnerabilities. These vulnerabilities could be exploited remotely."
ICSA-15-048-03,https://www.us-cert.gov/ics/advisories/ICSA-15-048-03,2015-02-17,2018-08-27,Yokogawa HART Device DTM Vulnerability,1,Yokogawa," Alexander Bolshev of Digital Security has identified an improper input vulnerability in the CodeWrights GmbH HART Device Type Manager (DTM) library utilized in Yokogawa’s HART Device DTM. CodeWrights GmbH has addressed the vulnerability with a new library, which both companies have begun to integrate."
ICSA-15-050-01A,https://www.us-cert.gov/ics/advisories/ICSA-15-050-01A,2015-02-19,2018-08-27,Siemens SIMATIC STEP 7 TIA Portal Vulnerabilities (Update A),1,Siemens," This updated advisory is a follow-up to the original advisory titled ICSA-15-050-01 Siemens SIMATIC STEP 7 TIA Portal Vulnerabilities that was published February 19, 2015, on the NCCIC/ICS-CERT web site. Siemens has identified two vulnerabilities in its SIMATIC STEP 7 (TIA Portal). Siemens has produced a patch that mitigates these vulnerabilities. These vulnerabilities were initially disclosed to Siemens by the Quarkslab team and Dmitry Sklyarov with PT-Security. One of the vulnerabilities is remotely exploitable."
ICSA-15-055-01,https://www.us-cert.gov/ics/advisories/ICSA-15-055-01,2015-02-24,2018-08-27,Software Toolbox Top Server Resource Exhaustion Vulnerability,1,Software Toolbox," Adam Crain of Automatak and Chris Sistrunk of Mandiant have identified a resource exhaustion vulnerability in the Software Toolbox Top Server application. Software Toolbox has produced a new version that mitigates this vulnerability. This vulnerability could be exploited remotely."
ICSA-15-055-02,https://www.us-cert.gov/ics/advisories/ICSA-15-055-02,2015-02-24,2018-08-29,Kepware Resource Exhaustion Vulnerability,1,Kepware Technologies," Adam Crain of Automatak and Chris Sistrunk of Mandiant have identified a resource exhaustion vulnerability in the Kepware Technologies’ DNP Master Driver for the KEPServerEX Communications Platform. Kepware Technologies has produced a new version that mitigates this vulnerability. This vulnerability could be exploited remotely."
ICSA-15-055-03,https://www.us-cert.gov/ics/advisories/ICSA-15-055-03,2015-02-24,2018-08-29,Schneider Electric Invensys Positioner Buffer Overflow Vulnerability,1,Schneider Electric," Ivan Sanchez from Nullcode Team has identified a buffer overflow security vulnerability in the DTM (Device Type Manager) software for Schneider Electric’s Invensys SRD Control Valve Positioner product line. Schneider Electric has produced a new version that mitigates this vulnerability."
ICSA-15-057-01,https://www.us-cert.gov/ics/advisories/ICSA-15-057-01,2015-02-26,2018-08-29,Network Vision IntraVue Code Injection Vulnerability,1,Network Vision," Researcher Jürgen Bilberger from Daimler TSS GmbH has identified a code injection vulnerability in Network Vision’s IntraVue software. Network Vision has produced a new version that mitigates this vulnerability. This vulnerability could be exploited remotely."
ICSA-15-062-01,https://www.us-cert.gov/ics/advisories/ICSA-15-062-01,2015-03-03,2018-08-27,MICROSYS PROMOTIC Stack Buffer Overflow,1,MICROSYS," An anonymous researcher working with HP’s Zero Day Initiative has identified a stack-based buffer overflow vulnerability in the MICROSYS, spol. s r.o. PROMOTIC application. MICROSYS, spol. s r.o. has produced a new version that mitigates this vulnerability. This vulnerability could be exploited remotely."
ICSA-15-062-02,https://www.us-cert.gov/ics/advisories/ICSA-15-062-02,2015-03-19,2018-08-27,Rockwell Automation FactoryTalk DLL Hijacking Vulnerabilities,1,Rockwell Automation," This advisory was originally posted to the US-CERT secure Portal library on March 3, 2015, and is being released to the NCCIC/ICS-CERT web site. Ivan Sanchez of NullCode &amp; Evilcode Team has identified multiple DLL Hijacking vulnerabilities in a software component included with Rockwell Automation’s FactoryTalk View Studio product. Rockwell Automation determined a similar vulnerability also affects the FactoryTalk Services Platform used with other FactoryTalk-branded software. Rockwell Automation has produced a patch that mitigates the vulnerabilities in the affected products."
ICSA-15-064-01A,https://www.us-cert.gov/ics/advisories/ICSA-15-064-01A,2015-04-23,2018-08-27,"Siemens SIMATIC HMI Basic, SINUMERIK, and Ruggedcom APE GHOST Vulnerability (Update A)",1,Siemens," This updated advisory is a follow-up to the original advisory titled ICSA-15-064-01 Siemens SIMATIC HMI Basic, SINUMERIK, and Ruggedcom APE GHOST Vulnerability that was published March 5, 2015, on the NCCIC/ICS-CERT web site. The “GHOST”a vulnerability in the glibc library affects the Siemens SINUMERIK and SIMATIC HMI Basic applications. Siemens has produced an update for SINUMERIK that mitigates this vulnerability."
ICSA-15-064-02A,https://www.us-cert.gov/ics/advisories/ICSA-15-064-02A,2015-04-23,2018-08-27,"Siemens SIMATIC ProSave, SIMATIC CFC, SIMATIC STEP 7, SIMOTION Scout, and STARTER Insufficiently Qualified Paths (Update A)",1,Siemens," This updated advisory is a follow-up to the original advisory titled ICSA-15-064-02 Siemens SIMATIC ProSave, SIMATIC CFC, SIMATIC STEP 7, SIMOTION Scout, and STARTER Insufficiently Qualified Paths that was published March 5, 2015, on the NCCIC/ICS-CERT web site. Ivan Sanchez from WiseSecurity Team has identified a search path vulnerability in the Siemens SIMATIC ProSave, SIMATIC CFC, SIMATIC STEP 7, SIMOTION Scout, and STARTER applications. Siemens has produced updates for each of these products that mitigates this vulnerability."
ICSA-15-064-03,https://www.us-cert.gov/ics/advisories/ICSA-15-064-03,2015-03-05,2018-08-27,Siemens SPC Controller Series Denial-of-Service Vulnerability,1,Siemens," Davide Peruzzi of GoSecure! has identified a denial-of-service (DoS) vulnerability in the Siemens SPC Controllers. Siemens has produced an update that mitigates this vulnerability. This vulnerability could be exploited remotely."
ICSA-15-064-04,https://www.us-cert.gov/ics/advisories/ICSA-15-064-04,2015-03-05,2018-08-22,Siemens SIMATIC S7-300 CPU Denial-of-Service Vulnerability,1,Siemens," Johannes Klick, Christian Pfahl, Martin Gebert, and Lucas Jacob from Freie Universität Berlin’s work team SCADACS have identified a Denial-of-Service (DoS) vulnerability in Siemens SIMATIC S7-300 CPUs. Siemens has developed mitigations for this vulnerability. This vulnerability could be exploited remotely."
ICSA-15-064-05,https://www.us-cert.gov/ics/advisories/ICSA-15-064-05,2015-03-05,2018-08-27,Siemens SPCanywhere App Vulnerabilities,1,Siemens," Karsten Sohr, Bernhard Berger, and Kai Hillmann from the TZI-Bremen, Kim Schlyter, Seyton Bradford, and Richard Warren from FortConsult, and Stefan Schuhmann have identified vulnerabilities in the Siemens SPCanywhere mobile application. Siemens has produced a new mobile application called SPC Connect that mitigates this vulnerability. Some of these vulnerabilities could be exploited remotely; others require local access."
ICSA-15-069-01,https://www.us-cert.gov/ics/advisories/ICSA-15-069-01,2015-03-10,2018-08-27,Cimon CmnView DLL Hijacking Vulnerability,1,"CIMON, Inc."," Ivan Sanchez of Wise Security has identified a DLL Hijacking vulnerability in the CIMON CmnView.exe application. CIMON, Inc. has produced a patch that mitigates this vulnerability. This vulnerability could be exploited remotely with social engineering and requires local user input."
ICSA-15-069-02,https://www.us-cert.gov/ics/advisories/ICSA-15-069-02,2015-03-10,2018-08-27,ABB HART Device DTM Vulnerability,1,ABB," Alexander Bolshev of Digital Security has identified an improper input vulnerability in the CodeWrights GmbH HART Device Type Manager (DTM) library used in ABB’s HART Device DTM. CodeWrights GmbH has addressed the vulnerability with a new library, which ABB have begun to integrate."
ICSA-15-069-03,https://www.us-cert.gov/ics/advisories/ICSA-15-069-03,2015-03-10,2018-08-27,SCADA Engine BACnet OPC Server Vulnerabilities,1,SCADA Engine," Independent researcher Josep Pi Rodriguez has identified three vulnerabilities in the SCADA Engine BACnet OPC Server application. SCADA Engine has produced a new software version that mitigates these vulnerabilities. Josep Pi Rodriguez has tested the new software version to validate that it resolves all three vulnerabilities. These vulnerabilities could be exploited remotely."
ICSA-15-069-04A,https://www.us-cert.gov/ics/advisories/ICSA-15-069-04A,2015-03-11,2018-08-27,Elipse E3 Process Control Vulnerability (Update A),1,Elipse," This updated advisory is a follow-up to the original advisory titled ICSA-15-069-04 Elipse E3 Process Control Vulnerability that was published March 10, 2015, on the NCCIC/ICS-CERT web site. Ivan Sanchez from Nullcode Team has identified a process control vulnerability in the Elipse E3 application. The process control vulnerability is a result of a third-party DLL, developed by Telerik, which is used in the Elipse E3 application. Elipse has released a new version that mitigates this vulnerability. The researcher has tested Elipse’s new version to validate that it resolves the vulnerability."
