icsa_id,icsa_url,icsa_release,icsa_update,icsa_description,icsa_is_update,icsa_vendor,icsa_oneliner
ICSA-12-335-01,https://www.us-cert.gov/ics/advisories/ICSA-12-335-01,2012-11-30,2018-09-05,Post Oak Bluetooth Traffic Systems Insufficient Entropy Vulnerability,1,Post Oak Traffic Systems," This advisory provides mitigation details for a vulnerability that impacts Post Oak Traffic AWAM Bluetooth Reader Systems. An independent research group composed of Nadia Heninger (University of California at San Diego), J. Alex Halderman, Zakir Durumeric, and Eric Wustrow (all from the University of Michigan) identified an insufficient entropy vulnerability  in authentication key generation in the Post Oak AWAM Bluetooth Reader Traffic System. By impersonating the device, an attacker can obtain the credentials of administrative users and potentially perform a Man-in-the-Middle (MitM) attack. Post Oak has validated the vulnerability and produced an updated firmware version that mitigates the vulnerability. According to Post Oak, its products are deployed in the transportation sector, mainly in the United States.  This vulnerability can be exploited remotely. "
ICSA-12-341-01,https://www.us-cert.gov/ics/advisories/ICSA-12-341-01,2013-01-10,2018-09-06,GE Proficy HMI/SCADA Cimplicity Integer Overflow,1,GE," This updated advisory is a follow-up to the original ICS-CERT Advisory titled ICSA-12-341-01P—GE PROFICY HMI/SCADA CIMPLICITY INTEGER OVERFLOW that was published December 06, 2012, to the US-CERT secure Portal library. Researcher Kuang-Chun Hung of Information and Communication Security Technology Center (ICST) has identified an improper input validation vulnerability in GE’s Intelligent Platforms Proficy HMI/SCADA—Cimplicity. This vulnerability could lead to a possible denial of service (DoS). GE has produced an updated product version that ICST has validated. ICST confirms that the product update resolves the reported vulnerability. This vulnerability can be exploited remotely."
ICSA-12-342-01B,https://www.us-cert.gov/ics/advisories/ICSA-12-342-01B,2014-04-10,2018-09-06,"Rockwell Allen-Bradley MicroLogix, SLC 500, and PLC-5 Fault Generation Vulnerability (Update B)",1,Rockwell Automation," This updated advisory is a follow-up to the updated advisory titled ICSA-12-342-01A Rockwell Allen-Bradley MicroLogix, SLC 500, and PLC-5 controller that was published December 11, 2012, on the NCCIC/ICS-CERT web site. Independent researcher Matthew Luallen of CYBATI has identified a fault generation vulnerability that can cause a denial of service (DoS) in the Rockwell Automation Allen-Bradley MicroLogix, SLC 500, and PLC-5 controller. Rockwell has released a notificationa that includes mitigation strategies for this vulnerability."
ICSA-12-348-01,https://www.us-cert.gov/ics/advisories/ICSA-12-348-01,2012-12-12,2015-02-25,Siemens ProcessSuite and Invensys Intouch Poorly Encrypted Password File,1,Invensys," This advisory provides mitigation details for a vulnerability that impacts Siemens ProcessSuite and Invensys Wonderware InTouch products. Researcher Seth Bromberger of NCI Security, LLC and independent researcher Slade Griffin have identified an insecure password storage vulnerability in both Siemens ProcessSuite and Invensys Wonderware InTouch applications. Siemens states that ProcessSuite is outdated and cannot be updated to match current security requirements; Siemens recommends upgrading to a more recent human-machine interface (HMI). Invensys recommends using Windows integrated security rather than the InTouch security subsystem but has created a new patch to mitigate this vulnerability. Successful exploitation of this vulnerability can allow an attacker to log in to the system as a privileged user and take over the application."
ICSA-12-349-01,https://www.us-cert.gov/ics/advisories/ICSA-12-349-01,2012-12-13,2013-05-07,Siemens Automation License Manager Uncontrolled Resource Consumption,1,Siemens," This advisory provides mitigation details for a vulnerability that impacts the Siemens Automation License Manager (ALM). Siemens ProductCERT has identified an uncontrolled resource consumption vulnerability1 in the Siemens ALM, which is used for license management by various Siemens software products. Siemens has produced a software update that fully resolves this vulnerability. Exploitation of this vulnerability would allow loss of availability of the system."
ICSA-12-354-01A,https://www.us-cert.gov/ics/advisories/ICSA-12-354-01A,2013-04-29,2018-09-06,Ruggedcom ROS Hard-Coded RSA SSL Private Key (Update A),1,RuggedCom," This Updated Advisory is a follow-up to the original advisory titled ICSA-12-354-01 RuggedCom ROS Hard-Coded RSA SSL Private Key that was published December 18, 2012, on the ICS-CERT Web page, as a follow-up to the original ICS-CERT alert ICS-ALERT-12-234-01 RuggedCom ROS Key Management Errors, which was released to the Web page on August 30, 2012. Independent researcher Justin W. Clarke of Cylance Inc., has identified the use of hard-coded RSA SSL private key in RuggedCom’s Rugged Operating System (ROS). RuggedCom, an independent subsidiary of Siemens, has produced a new version of the ROS that mitigates this vulnerability. This vulnerability could be exploited remotely. Exploits that target this vulnerability are publicly available."
ICSA-12-354-02,https://www.us-cert.gov/ics/advisories/ICSA-12-354-02,2012-12-08,2013-08-28,Carlo Gavazzi EOS Box Multiple Vulnerabilities,1,Carlo Gavazzi," This advisory provides mitigation details for multiple vulnerabilities that impact the Carlo Gavazzi EOS-Box Photovoltaic Monitoring System. Carlo Gavazzi has identified two vulnerabilities in the Carlo Gavazzi EOS-Box Photovoltaic Monitoring System. Carlo Gavazzi has produced a firmware update that fully resolves these vulnerabilities. Successful exploitation of the vulnerabilities would allow an attacker to gain unauthorized access, access private information, and execute remote code. This device is used in the energy sector. These vulnerabilities could be exploitable remotely. Exploits that target these vulnerabilities are publicly available."
ICSA-12-362-01,https://www.us-cert.gov/ics/advisories/ICSA-12-362-01,2012-12-26,2013-04-30,I-GEN opLYNX Central Authentication Bypass,1,I-GEN," This advisory provides mitigation details for a vulnerability that impacts the i-GEN opLYNX Central software. Exploitation of this vulnerability would allow partial leakage of information and access to system settings. Independent researcher Anthony Cicalla has identified an authentication bypass vulnerability in i-GEN Solutions opLYNX Central application. i-GEN Solutions has produced a new version that mitigates this vulnerability. The researcher has tested the new version to validate that it resolves the vulnerability. This vulnerability impacts the energy sector, mainly in Canada. This vulnerability could be exploited remotely."
ICSA-13-011-01,https://www.us-cert.gov/ics/advisories/ICSA-13-011-01,2013-01-10,2018-09-06,3S CoDeSys Vulnerabilities,1,3S-Smart Software Solutions," This advisory is a follow-up to the ICS-CERT Alert titled “ICS-ALERT-12-097-02A 3S-Software CoDeSys Improper Access Control (Update A)"" that was published October 26, 2012. This advisory provides mitigation details for multiple vulnerabilities that affect the 3S-Smart Software Solutions CoDeSys Runtime Toolkit. Independent researcher Reid Wightman of IOActive, formerly of Digital Bond, identified1 an improper access control and a directory traversal vulnerability in the 3S CoDeSys Runtime application without coordination with ICS-CERT, the vendor, or any other coordinating entity known to ICS-CERT. Exploitation of these vulnerabilities would allow unauthorized access to the system and unauthorized access to the file system. The CoDeSys Runtime Toolkit is used in a number of vendor’s products worldwide. 3S has developed a patch that implements a password for authentication to the system. Reid Wightman has validated that the patch, issued by 3S, mitigates theses vulnerabilities. These vulnerabilities can be exploited remotely. Exploits that target these vulnerabilities are known to be publicly available. This researcher has released proof-of-concept (PoC) code for these vulnerabilities."
ICSA-13-011-02,https://www.us-cert.gov/ics/advisories/ICSA-13-011-02,2013-01-12,2014-03-06,SpecView Directory Traversal,1,SpecView," This advisory is a follow up to the original alert titled ICS-ALERT-12-214-01 SpecView Directory Traversal that was published August 01, 2012, on the ICS-CERT Web. This advisory provides mitigation details for a vulnerability, which impacts SpecView products. Independent researcher Luigi Auriemma identified a directory traversal vulnerability with proof-of-concept (PoC) exploit code affecting SpecView, a supervisory control and data acquisition/human-machine interface (SCADA/HMI) product. Successful exploitation could result in data leakage and file manipulation. This report was released without coordination with either the vendor or ICS-CERT. This vulnerability could be exploited remotely. Exploits that target this vulnerability are publicly available. SpecView has released a new build that addresses this vulnerability. Luigi Auriemma has verified the new build fixes the vulnerability."
ICSA-13-011-03,https://www.us-cert.gov/ics/advisories/ICSA-13-011-03,2013-01-10,2019-02-13,Rockwell Automation ControlLogix PLC Vulnerabilities,1,Rockwell Automation," This advisory is a follow up to the original alert titled ICS-ALERT-12-020-02A—Rockwell Automation ControlLogix PLC Vulnerabilities that was published February 14, 2012, on the ICS-CERT Web page. Independent researcher Rubén Santamarta of IOActive identified vulnerabilities in Rockwell Automation’s ControlLogix PLC and released proof-of-concept (exploit) code at the Digital Bond S4 Conference on January 19, 2012. The vulnerabilities are exploitable by transmitting arbitrary commands from a control interface to the programmable logic controller (PLC) or network interface card (NIC). The information was released without coordination with either the vendor or ICS-CERT. Rockwell Automation released firmware patches on July 18, 2012, that resolve the following vulnerabilities. There have been no updates from Rockwell since these patches were released. Exploitation of these vulnerabilities could allow loss of confidentiality, integrity, and availability of the device. These vulnerabilities could be exploited remotely. Exploits that target these vulnerabilities are publicly available."
ICSA-13-014-01,https://www.us-cert.gov/ics/advisories/ICSA-13-014-01,2013-01-13,2013-05-08,Siemens SIMATIC RF Manager ActiveX Buffer Overflow,1,Siemens," This advisory provides mitigation details for a vulnerability that impacts the Siemens SIMATIC RF Manager. Siemens has identified a buffer overflow vulnerability in the ActiveX component of the SIMATIC RF Manager. Siemens has produced a patch that mitigates this vulnerability. Successful exploitation of this vulnerability could lead to possible remote code execution or a denial of service. This vulnerability could be exploited remotely."
ICSA-13-016-01,https://www.us-cert.gov/ics/advisories/ICSA-13-016-01,2013-01-16,2018-09-06,Schneider Electric Authenticated Communication Risk Vulnerability,1,Schneider Electric," ICS-CERT received a report from Schneider Electric concerning an Authenticated Communication Risk vulnerability in the Schneider Electric Software Update (SESU) utility. This vulnerability was reported to Schneider Electric by security researcher Arthur Gervais. The SESU is a centralized update mechanism for updating Schneider Electric software on Windows PC. Schneider Electric has updated the SESU client as of January 2013, which adds the use of HTTPS to resolve this vulnerability.This vulnerability could be exploited remotely."
ICSA-13-018-01,https://www.us-cert.gov/ics/advisories/ICSA-13-018-01,2013-01-17,2013-05-06,Schneider Electric IGSS Buffer Overflow,1,Schneider Electric," Independent researcher Aaron Portnoy of Exodus Intelligence has identified a buffer overflow vulnerability in Schneider Electric’s Interactive Graphical SCADA System (IGSS) application. Schneider Electric has produced a patch that fully resolves this vulnerability. Aaron Portnoy has validated this patch. This vulnerability could be exploited remotely."
ICSA-13-022-01,https://www.us-cert.gov/ics/advisories/ICSA-13-022-01,2013-01-21,2013-04-30,GE Proficy Real-Time Information Portal Information Disclosure Vulnerabilities,1,GE," This advisory provides mitigation details for multiple vulnerabilities that impact the GE Intelligent Platforms Proficy Real-Time Information Portal. General Electric (GE) has addressed two vulnerabilities in the GE Intelligent Platforms Proficy Real-Time Information Portal. Exploitation of these vulnerabilities would result in information disclosure. The vulnerabilities can be exploited remotely. GE has produced two security advisories (GEIP12-14 and GEIP12-15) available on the GE Intelligent Platforms support Web site to inform customers about these vulnerabilities."
ICSA-13-022-02,https://www.us-cert.gov/ics/advisories/ICSA-13-022-02,2013-01-21,2013-09-12,GE Intelligent Platforms Proficy Cimplicity Multiple Vulnerabilities,1,GE," This advisory provides mitigation details for multiple vulnerabilities that impact GE Intelligent Platforms Proficy HMI/SCADA—CIMPLICITY. General Electric (GE) has addressed two vulnerabilities in GE Intelligent Platforms Proficy HMI/SCADA—CIMPLICITY: a directory transversal vulnerability and improper input validation vulnerability. GE has released two security advisories (GEIP12-13 and GEIP12-19) available on the GE Intelligent Platforms support Web site to inform customers about these vulnerabilities. A remote attacker could exploit these vulnerabilities."
ICSA-13-024-01,https://www.us-cert.gov/ics/advisories/ICSA-13-024-01,2013-02-24,2018-09-05,Beijer Electronics ADP and H-Designer Buffer Overflow Vulnerability,1,Beijer Electronics," This advisory provides details about a buffer overflow vulnerability in multiple Beijer Electronics ADP and H-designer products. Independent researcher Kuang-Chun Hung of Information and Communication Security Technology Center (ICST) has identified a buffer overflow vulnerability in Beijer ADP and H-Designer applications. This vulnerability can allow attackers to execute arbitrary code and gain unauthorized access. This vulnerability affects systems deployed in the critical manufacturing, food and agriculture, transportation, and energy sectors. Beijer has created a new version that corrects this vulnerability. Researcher Morgan Hung has tested this version to verify that it mitigates the reported problem."
ICSA-13-036-01A,https://www.us-cert.gov/ics/advisories/ICSA-13-036-01A,2013-02-21,2013-05-01,Wonderware Intelligence Tableau Server Ruby on Rails Improper Input Validation (Update A),1,Invensys," This updated advisory was orignally posted to the US-CERT secure Portal library on February 5, 2013, and is now being released to the ICS-CERT Web page. Mitigation details for multiple vulnerabilities that impact third-party software integrated into the Invensys Wonderware Intelligence product are provided.  Exploitation of these vulnerabilities could allow loss of availability, integrity, and confidentiality. Invensys Wonderware has become aware of input validation and permissions, privileges, and access controls vulnerabilities in Ruby on Rails that was discovered by research Aaron Patterson.  Ruby on Rails is an open source Web framework that is used by Tableau Server Software, which is a third-party component, shipped with Invensys Wonderware Intelligence. These vulnerabilities can be exploited remotely.  Successful exploit of these vulnerabilities could affect Wonderware Intelligence products deployed in the manufacturing, energy, water and wastewater, healthcare, and building automation sectors. Invensys Wonderware has produced a new product version and confirmed that it resolves the reported vulnerabilities."
ICSA-13-036-02,https://www.us-cert.gov/ics/advisories/ICSA-13-036-02,2013-02-04,2015-01-29,Ecava IntegraXor ActiveX Buffer Overflow,1,Ecava," This advisory provides mitigation details for a vulnerability that impacts the Ecava IntegraXor application. Independent researcher Andrew Brooks has identified a buffer overflow vulnerability in Ecava’s IntegraXor application. Ecava has produced a patch that mitigates this vulnerability. The researcher has tested the patch to validate that it resolves this vulnerability. Exploitation of this vulnerability would allow an attacker to execute arbitrary code or cause a denial of service (DoS).This vulnerability could be exploited remotely."
ICSA-13-038-01A,https://www.us-cert.gov/ics/advisories/ICSA-13-038-01A,2013-03-12,2018-09-06,360 Systems Image Server 2000 Series Remote Root Access (Update A),1,360 Systems," This updated advisory is a follow-up to the original advisory titled ICSA-13-038-01—360 Systems Image Server 2000 Series Remote Root Access that was published March 06, 2013, on the ICS-CERT Web site. This advisory provides mitigation details for a vulnerability that impacts the 360 Systems’ Image Server 2000 series devices. Exploitation of this vulnerability could cause loss of integrity.Independent researchers Neil Smith and Ryan Green have identified a hard-coded password vulnerability in 360 Systems’ Image Server 2000 series devices. 360 Systems has not released a patch, new version, or firmware upgrade to fix this issue, but recommends mitigating this vulnerability by removing the device from any public-facing networks. This vulnerability impacts the communications and emergency services sectors. This vulnerability could be exploited remotely."
ICSA-13-042-01,https://www.us-cert.gov/ics/advisories/ICSA-13-042-01,2013-02-11,2015-09-03,MOXA EDR-G903 Series Multiple Vulnerabilities,1,Moxa," This advisory provides mitigation details for vulnerabilities that impact Moxa EDR-G903 Series Routers.Independent researcher Neil Smith identified a hard-coded user account vulnerability and an insufficient entropy vulnerability in Moxa’s EDR-G903 series routers. By impersonating the device, an attacker can perform a Man-in-the-Middle (MitM) attack to obtain the credentials of administrative users. Moxa has produced and released a patch that resolves these vulnerabilities on December 17, 2012. Neil Smith has tested the patch and confirms that it fully resolves these vulnerabilities. If exploited, attackers could affect the availability, integrity, and confidentiality of the EDR-G903 routers. These vulnerabilities affect devices deployed in the critical manufacturing, commercial facilities, energy, water and wastewater, and other sectors.These vulnerabilities could be exploited remotely."
ICSA-13-043-01,https://www.us-cert.gov/ics/advisories/ICSA-13-043-01,2013-02-11,2013-05-07,Schneider Electric Accutech Manager Heap Overflow,1,Schneider Electric," This advisory provides mitigation details for a vulnerability that impacts the Schneider Electric Accutech Manager. Independent researcher Aaron Portnoy of Exodus Intelligence has identified a heap-based buffer overflow vulnerability in Schneider Electric’s Accutech Manager application. Schneider Electric has produced an update that mitigates this vulnerability. This researcher has tested the update and verified that it fixes the vulnerability. Exploitation of this vulnerability could allow an attacker to execute code with administrator privileges. This vulnerability could affect the energy, water and wastewater, and critical manufacturing sectors. This vulnerability could be exploited remotely. Exploit code for this vulnerability has recently been published by another researcher who was not part of any coordinated effort with the vendor, ICS-CERT, or Exodus Intelligence."
ICSA-13-043-02A,https://www.us-cert.gov/ics/advisories/ICSA-13-043-02A,2013-03-27,2013-05-08,WellinTech KingView KingMess Buffer Overflow (Update A),1,WellinTech," This updated advisory is a follow-up to the original advisory titled ICSA-13-043-02—WellinTech KingView KingMess Buffer Overflow that was published February 12, 2013, on the ICS-CERT Web page. This updated advisory provides mitigation details for a vulnerability that impacts the WellinTech KingView KingMess application. Researchers Lucas Apa and Carlos Mario Penagos Hollman of IOActive have identified a buffer overflow vulnerability in WellinTech’s KingView KingMess application. WellinTech produced and released a patch on November 15, 2012, that mitigates this vulnerability. The researchers have validated that this patch fixes the vulnerability. Exploitation of this vulnerability could allow loss of confidentiality and integrity. This vulnerability could be exploited remotely. --------- Begin Update A Part 1 of 2 -------- Exploits that target this vulnerability are publicly available. A Metaspoit module for this vulnerability has been released. --------- End Update A Part 1 of 2 ----------"
ICSA-13-045-01,https://www.us-cert.gov/ics/advisories/ICSA-13-045-01,2013-02-14,2013-05-08,Tridium NiagaraAX Directory Traversal Vulnerability,1,Tridium," This advisory provides mitigation details for a vulnerability in the Tridium NiagaraAX software. Independent researchers Billy Rios and Terry McCorkle discovered a directory traversal vulnerability in the Tridium NiagaraAX software product. They demonstrated that with a valid user account or guest privileges enabled, privilege escalation is possible on a NiagaraAX system. Exploitation of this vulnerability could allow loss of availability, integrity, and confidentiality of the system.Tridium has produced a patch that mitigates this vulnerability. This vulnerability is remotely exploitable."
ICSA-13-050-01A,https://www.us-cert.gov/ics/advisories/ICSA-13-050-01A,2013-03-27,2018-09-06,3S CODESYS Gateway-Server Vulnerabilities (Update A),1,3S-Smart Software Solutions," This updated advisory is a follow-up to the original advisory titled ICSA-13-050-01, 3S CODESYS Gateway-Server Vulnerabilities that was published February 19, 2013, on the ICS-CERT Web page. This updated advisory provides mitigation details for five vulnerabilities in the 3S-Smart Software Solutions GmbH CODESYS Gateway-Server. Independent researcher Aaron Portnoy of Exodus Intelligence has identified five vulnerabilities in the 3S CODESYS Gateway-Server application. 3S has produced a security patch that mitigates these vulnerabilities. Successful exploitation of these vulnerabilities could allow remote code execution. The Gateway-Server is a third-party component found in multiple control systems manufacturer’s products. These vulnerabilities affect products primarily found in the energy, critical manufacturing, and industrial automation industries. These vulnerabilities could be exploited remotely."
ICSA-13-053-01,https://www.us-cert.gov/ics/advisories/ICSA-13-053-01,2013-03-12,2013-04-30,Emerson DeltaV Uncontroller Resource Consumption Vulnerability,1,Emerson," This advisory was originally posted to the US-CERT secure portal library on February 22, 2013, and is now being released to the ICS-CERT Web page. This advisory provides mitigation details for a vulnerability that impacts the Emerson DeltaV MD and SD controllers.Independent researcher Joel Langill has identified an uncontrolled resource consumption vulnerability in Emerson’s DeltaV MD and SD controllers that could lead to a denial of service (DoS). Emerson has produced a hotfix that mitigates this vulnerability. Exploitation of this vulnerability could cause loss of availability."
ICSA-13-053-02A,https://www.us-cert.gov/ics/advisories/ICSA-13-053-02A,2013-03-14,2018-09-06,"Honeywell EBI, SymmetrE, and ComfortPoint Open Manager Station (Update A)",1,Honeywell," This updated advisory is a follow-up to the original advisory titled ICSA-13-053-02--Honeywell Enterprise Buildings Integrator (EBI), SymmetrE, and ComfortPoint Open Manager Station that was published February 22, 2013, on the ICS-CERT Web page. This advisory provides mitigation details for a vulnerability that impacts the Honeywell EBI. Independent researcher Juan Vazquez of Rapid7 privately disclosed an ActiveX vulnerability in the Honeywell EBI, SymmetrE, and ComfortPoint Open Manager (CPO-M) Station, and HMIWeb Browser client packages. Honeywell has produced an update that mitigates this vulnerability. Rapid7 has tested the update to validate that it resolves the vulnerability. Exploitation of this vulnerability could allow partial loss of availability, integrity, and confidentiality. This vulnerability could affect systems deployed in the government facilities and commercial facilities sectors. This vulnerability could be exploited remotely."
ICSA-13-067-01,https://www.us-cert.gov/ics/advisories/ICSA-13-067-01,2013-03-13,2018-09-06,InduSoft Advantech Studio Directory Traversal,1,"Advantech, InduSoft"," This advisory is a follow-up to the alert titled ICS-ALERT-13-004-01—Advantech Studio Directory Traversal that was published January 4, 2013, on the ICS-CERT Web page. Independent researcher Nin3 released proof-of-concept (PoC) exploit code for a directory traversal vulnerability in Indusoft Studio and Advantech Studio applications without coordination with ICS-CERT, the vendor, or any other coordinating entity known to ICS-CERT. Indusoft originally produced this product that was rebranded to Advantech Studio (both products share the vulnerability). Indusoft has produced a fix that mitigates this vulnerability.This vulnerability could be exploited remotely. Exploits that target this vulnerability are publicly available."
